{
"schema_version":1,
"experiment_id":"semantic-retargeting-v1",
"dataset_version":1,
"timing_note":"elapsed_ms is host-specific evidence only and never a correctness gate",
"results":[{"schema_version":1,"fixture_id":"function-rename","category":"function rename","strategy":"semantic","actual_outcome":"applied","expected_outcome":"exact-bytes","selected_file":"src/greeting.ts","selected_span":{"start_byte":16,"end_byte":21},"target_selection_correct":true,"exact_resulting_bytes_correct":true,"confidence":"exact","match_stage":"exact-original-bytes-and-span","parser_complete":true,"resolution_complete":true,"type_resolution_complete":true,"textual_fallback_used":false,"candidate_count":1,"safe_conflict":false,"false_confident":false,"false_negative":false,"false_application":false,"bytes_changed_outside_intended_span":false,"validation_result":"byte-splice-valid","elapsed_ms":0.003099,"tool_versions":{"tool":"paengi-semantic-experiment-v1","typescript":"5.9.3","node_minimum":"14.17.0","adapter_protocol":1}},
{"schema_version":1,"fixture_id":"function-rename","category":"function rename","strategy":"textual","actual_outcome":"applied","expected_outcome":"exact-bytes","selected_file":"src/greeting.ts","selected_span":{"start_byte":16,"end_byte":21},"target_selection_correct":true,"exact_resulting_bytes_correct":true,"confidence":"not-semantic","match_stage":"exact-original-span","parser_complete":null,"resolution_complete":null,"type_resolution_complete":null,"textual_fallback_used":false,"candidate_count":1,"safe_conflict":false,"false_confident":false,"false_negative":false,"false_application":false,"bytes_changed_outside_intended_span":false,"validation_result":"byte-splice-valid","elapsed_ms":0.002146,"tool_versions":{"tool":"paengi-semantic-experiment-v1","typescript":"5.9.3","node_minimum":"14.17.0","adapter_protocol":1}},
{"schema_version":1,"fixture_id":"function-move-within-file","category":"function move within one file","strategy":"semantic","actual_outcome":"applied","expected_outcome":"exact-bytes","selected_file":"src/greeting.ts","selected_span":{"start_byte":38,"end_byte":43},"target_selection_correct":true,"exact_resulting_bytes_correct":true,"confidence":"high","match_stage":"module-and-exported-symbol-path","parser_complete":true,"resolution_complete":true,"type_resolution_complete":true,"textual_fallback_used":false,"candidate_count":1,"safe_conflict":false,"false_confident":false,"false_negative":false,"false_application":false,"bytes_changed_outside_intended_span":false,"validation_result":"byte-splice-valid","elapsed_ms":0.001192,"tool_versions":{"tool":"paengi-semantic-experiment-v1","typescript":"5.9.3","node_minimum":"14.17.0","adapter_protocol":1}},
{"schema_version":1,"fixture_id":"function-move-within-file","category":"function move within one file","strategy":"textual","actual_outcome":"applied","expected_outcome":"exact-bytes","selected_file":"src/greeting.ts","selected_span":{"start_byte":38,"end_byte":43},"target_selection_correct":true,"exact_resulting_bytes_correct":true,"confidence":"not-semantic","match_stage":"unique-exact-preimage","parser_complete":null,"resolution_complete":null,"type_resolution_complete":null,"textual_fallback_used":false,"candidate_count":1,"safe_conflict":false,"false_confident":false,"false_negative":false,"false_application":false,"bytes_changed_outside_intended_span":false,"validation_result":"byte-splice-valid","elapsed_ms":0.005007,"tool_versions":{"tool":"paengi-semantic-experiment-v1","typescript":"5.9.3","node_minimum":"14.17.0","adapter_protocol":1}},
{"schema_version":1,"fixture_id":"function-move-across-files","category":"function move across files","strategy":"semantic","actual_outcome":"applied","expected_outcome":"exact-bytes","selected_file":"src/moved/greeting.ts","selected_span":{"start_byte":32,"end_byte":37},"target_selection_correct":true,"exact_resulting_bytes_correct":true,"confidence":"high","match_stage":"resolved-alias-or-symbol","parser_complete":true,"resolution_complete":true,"type_resolution_complete":true,"textual_fallback_used":false,"candidate_count":1,"safe_conflict":false,"false_confident":false,"false_negative":false,"false_application":false,"bytes_changed_outside_intended_span":false,"validation_result":"byte-splice-valid","elapsed_ms":0.001907,"tool_versions":{"tool":"paengi-semantic-experiment-v1","typescript":"5.9.3","node_minimum":"14.17.0","adapter_protocol":1}},
{"schema_version":1,"fixture_id":"function-move-across-files","category":"function move across files","strategy":"textual","actual_outcome":"applied","expected_outcome":"exact-bytes","selected_file":"src/moved/greeting.ts","selected_span":{"start_byte":32,"end_byte":37},"target_selection_correct":true,"exact_resulting_bytes_correct":true,"confidence":"not-semantic","match_stage":"unique-exact-preimage","parser_complete":null,"resolution_complete":null,"type_resolution_complete":null,"textual_fallback_used":false,"candidate_count":1,"safe_conflict":false,"false_confident":false,"false_negative":false,"false_application":false,"bytes_changed_outside_intended_span":false,"validation_result":"byte-splice-valid","elapsed_ms":0.005007,"tool_versions":{"tool":"paengi-semantic-experiment-v1","typescript":"5.9.3","node_minimum":"14.17.0","adapter_protocol":1}},
{"schema_version":1,"fixture_id":"class-rename","category":"class rename","strategy":"semantic","actual_outcome":"applied","expected_outcome":"exact-bytes","selected_file":"src/greeting.ts","selected_span":{"start_byte":16,"end_byte":21},"target_selection_correct":true,"exact_resulting_bytes_correct":true,"confidence":"exact","match_stage":"exact-original-bytes-and-span","parser_complete":true,"resolution_complete":true,"type_resolution_complete":true,"textual_fallback_used":false,"candidate_count":1,"safe_conflict":false,"false_confident":false,"false_negative":false,"false_application":false,"bytes_changed_outside_intended_span":false,"validation_result":"byte-splice-valid","elapsed_ms":0.000954,"tool_versions":{"tool":"paengi-semantic-experiment-v1","typescript":"5.9.3","node_minimum":"14.17.0","adapter_protocol":1}},
{"schema_version":1,"fixture_id":"class-rename","category":"class rename","strategy":"textual","actual_outcome":"applied","expected_outcome":"exact-bytes","selected_file":"src/greeting.ts","selected_span":{"start_byte":16,"end_byte":21},"target_selection_correct":true,"exact_resulting_bytes_correct":true,"confidence":"not-semantic","match_stage":"exact-original-span","parser_complete":null,"resolution_complete":null,"type_resolution_complete":null,"textual_fallback_used":false,"candidate_count":1,"safe_conflict":false,"false_confident":false,"false_negative":false,"false_application":false,"bytes_changed_outside_intended_span":false,"validation_result":"byte-splice-valid","elapsed_ms":0.001192,"tool_versions":{"tool":"paengi-semantic-experiment-v1","typescript":"5.9.3","node_minimum":"14.17.0","adapter_protocol":1}},
{"schema_version":1,"fixture_id":"method-rename","category":"method rename","strategy":"semantic","actual_outcome":"applied","expected_outcome":"exact-bytes","selected_file":"src/greeting.ts","selected_span":{"start_byte":16,"end_byte":21},"target_selection_correct":true,"exact_resulting_bytes_correct":true,"confidence":"exact","match_stage":"exact-original-bytes-and-span","parser_complete":true,"resolution_complete":true,"type_resolution_complete":true,"textual_fallback_used":false,"candidate_count":1,"safe_conflict":false,"false_confident":false,"false_negative":false,"false_application":false,"bytes_changed_outside_intended_span":false,"validation_result":"byte-splice-valid","elapsed_ms":0.000954,"tool_versions":{"tool":"paengi-semantic-experiment-v1","typescript":"5.9.3","node_minimum":"14.17.0","adapter_protocol":1}},
{"schema_version":1,"fixture_id":"method-rename","category":"method rename","strategy":"textual","actual_outcome":"applied","expected_outcome":"exact-bytes","selected_file":"src/greeting.ts","selected_span":{"start_byte":16,"end_byte":21},"target_selection_correct":true,"exact_resulting_bytes_correct":true,"confidence":"not-semantic","match_stage":"exact-original-span","parser_complete":null,"resolution_complete":null,"type_resolution_complete":null,"textual_fallback_used":false,"candidate_count":1,"safe_conflict":false,"false_confident":false,"false_negative":false,"false_application":false,"bytes_changed_outside_intended_span":false,"validation_result":"byte-splice-valid","elapsed_ms":0.000954,"tool_versions":{"tool":"paengi-semantic-experiment-v1","typescript":"5.9.3","node_minimum":"14.17.0","adapter_protocol":1}},
{"schema_version":1,"fixture_id":"method-move","category":"method move","strategy":"semantic","actual_outcome":"applied","expected_outcome":"exact-bytes","selected_file":"src/greeting.ts","selected_span":{"start_byte":29,"end_byte":34},"target_selection_correct":true,"exact_resulting_bytes_correct":true,"confidence":"high","match_stage":"module-and-exported-symbol-path","parser_complete":true,"resolution_complete":true,"type_resolution_complete":true,"textual_fallback_used":false,"candidate_count":1,"safe_conflict":false,"false_confident":false,"false_negative":false,"false_application":false,"bytes_changed_outside_intended_span":false,"validation_result":"byte-splice-valid","elapsed_ms":0.000954,"tool_versions":{"tool":"paengi-semantic-experiment-v1","typescript":"5.9.3","node_minimum":"14.17.0","adapter_protocol":1}},